Verdict,Speaker,Text,Speaker_title,Speaker_party,File_id,Sentence_id,Length,Line_number,Sentiment,Checked? ,CNN,Reuters,AP News,NYT,Atlantic,Politifact,WashPost,Fact Check,times fact-checked
-1,Obama,"But what the American people understand is that I look at what we need to get done to keep the American people safe and to move our interests forward, and I make those decisions.",President,DEMOCRAT,2012-10-22.txt,27608,34,748,0.783614,0,0,0,0,0,0,0,0,0,0
-1,Romney,You can't -- but you can't have the president just lay out a whole series of items without giving me a chance to respond.,Governor,REPUBLICAN,2012-10-22.txt,27613,24,753,-0.382077,0,0,0,0,0,0,0,0,0,0
-1,Romney,"Well, we're going to be finished by 2014, and when I'm president, we'll make sure we bring our troops out by the end of 2014.",Governor,REPUBLICAN,2012-10-22.txt,27622,25,762,0.566767,0,0,0,0,0,0,0,0,0,0
-1,Romney,The commanders and the generals there are on track to do so.,Governor,REPUBLICAN,2012-10-22.txt,27623,12,763,-0.399556,0,0,0,0,0,0,0,0,0,0
1,Romney,We've seen progress over the past several years.,Governor,REPUBLICAN,2012-10-22.txt,27624,8,764,0.389024,0,0,0,0,0,0,0,0,0,0
1,Romney,The surge has been successful and the training program is proceeding apace.,Governor,REPUBLICAN,2012-10-22.txt,27625,12,765,0.307441,0,0,0,0,0,0,0,0,0,0
1,Romney,"There are now a large number of Afghan Security Forces, 350,000 that are ready to step in to provide security and we're going to be able to make that transition by the end of 2014.",Governor,REPUBLICAN,2012-10-22.txt,27626,35,766,0.55244,0,0,0,0,0,0,0,0,0,0
1,Romney,So our troops will come home at that point.,Governor,REPUBLICAN,2012-10-22.txt,27627,9,767,0,0,0,0,0,0,0,0,0,0,0
-1,Romney,"I can tell you at the same time, that we will make sure that we look at what's happening in Pakistan, and recognize that what's happening in Pakistan is going to have a major impact on the success in Afghanistan.",Governor,REPUBLICAN,2012-10-22.txt,27628,40,768,0,0,0,0,0,0,0,0,0,0,0
-1,Romney,And I say that because I know a lot of people that feel like we should just brush our hands and walk away.,Governor,REPUBLICAN,2012-10-22.txt,27629,23,769,0.327562,0,0,0,0,0,0,0,0,0,0
-1,Romney,"And I don't mean you, Mr. President, but some people in the -- in our nation feel that Pakistan is being nice to us, and that we should walk away fro mthem.",Governor,REPUBLICAN,2012-10-22.txt,27630,32,770,0.395076,0,0,0,0,0,0,0,0,0,0
1,Romney,"But Pakistan is important to the region, to the world and to us, because Pakistan has 100 nuclear warheads and they're rushing to build a lot more.",Governor,REPUBLICAN,2012-10-22.txt,27631,27,771,0,0,0,0,0,0,0,0,0,0,0
-1,Romney,They'll have more than Great Britain sometime in the -- in the relatively near future.,Governor,REPUBLICAN,2012-10-22.txt,27632,15,772,0,0,0,0,0,0,0,0,0,0,0
1,Romney,They also have the Haqqani Network and the Taliban existent within their country.,Governor,REPUBLICAN,2012-10-22.txt,27633,13,773,-0.367462,0,0,0,0,0,0,0,0,0,0
-1,Romney,"And so a Pakistan that falls apart, becomes a failed state, would be of extraordinary danger to Afghanistan and to us.",Governor,REPUBLICAN,2012-10-22.txt,27634,21,774,-0.843793,0,0,0,0,0,0,0,0,0,0
-1,Romney,And so we're going to have to remain helpful in encouraging Pakistan to move towards a more stable government and rebuild the relationship with us.,Governor,REPUBLICAN,2012-10-22.txt,27635,25,775,0.911091,0,0,0,0,0,0,0,0,0,0
-1,Romney,And that means that our aid that we provide to Pakistan is going to have to be conditioned upon certain benchmarks being met.,Governor,REPUBLICAN,2012-10-22.txt,27636,23,776,0.624231,0,0,0,0,0,0,0,0,0,0
-1,Romney,"So for me, I look at this as both a need to help move Pakistan in the right direction, and also to get Afghanistan to be ready, and they will be ready by the end of 2014.",Governor,REPUBLICAN,2012-10-22.txt,27637,37,777,0.407955,0,0,0,0,0,0,0,0,0,0
1,Obama,"When I came into office, we were still bogged down in Iraq and Afghanistan had been drifting for a decade.",President,DEMOCRAT,2012-10-22.txt,27639,20,779,-0.742955,0,0,0,0,0,0,0,0,0,0
0,Obama,"We ended the war in Iraq, refocused our attention on Afghanistan, and we did deliver a surge of troops.",President,DEMOCRAT,2012-10-22.txt,27640,19,780,-0.626461,0,0,0,0,0,0,0,0,0,0
0,Obama,That was facilitated in part because we had ended the war in Iraq.,President,DEMOCRAT,2012-10-22.txt,27641,13,781,0,0,0,0,0,0,0,0,0,0,0
-1,Obama,And we are now in a position where we have met many of the objectives that got us there in the first place.,President,DEMOCRAT,2012-10-22.txt,27642,23,782,0,0,0,0,0,0,0,0,0,0,0
-1,Obama,Part of what had happened is we'd forgotten why we had gone.,President,DEMOCRAT,2012-10-22.txt,27643,12,783,-0.788525,0,0,0,0,0,0,0,0,0,0
1,Obama,"We went because there were people who were responsible for 3,000 American deaths.",President,DEMOCRAT,2012-10-22.txt,27644,13,784,-0.259137,0,0,0,0,0,0,0,0,0,0
1,Obama,And so we decimated Al Qaida's core leadership in the border regions between Afghanistan and Pakistan.,President,DEMOCRAT,2012-10-22.txt,27645,16,785,-0.515281,0,0,0,0,0,0,0,0,0,0
0,Obama,We then started to build up Afghan forces.,President,DEMOCRAT,2012-10-22.txt,27646,8,786,0,0,0,0,0,0,0,0,0,0,0
1,Obama,"And we're now in a position where we can transition out, because there's no reason why Americans should die when Afghans are perfectly capable of defending their own country.",President,DEMOCRAT,2012-10-22.txt,27647,29,787,-0.393777,0,0,0,0,0,0,0,0,0,0
-1,Obama,"Now, that transition has to take place in a responsible fashion.",President,DEMOCRAT,2012-10-22.txt,27648,11,788,0,0,0,0,0,0,0,0,0,0,0
-1,Obama,"We've been there a long time, and we've got to make sure that we and our coalition partners are pulling out responsibly and giving Afghans the capabilities that they need.",President,DEMOCRAT,2012-10-22.txt,27649,30,789,0.746206,0,0,0,0,0,0,0,0,0,0
-1,Obama,But what I think the American people recognize is after a decade of war it's time to do some nation building here at home.,President,DEMOCRAT,2012-10-22.txt,27650,24,790,0,1,0,0,1,0,0,0,0,0,1
-1,Obama,"And what we can now do is free up some resources, to, for example, put Americans back to work, especially our veterans, rebuilding our roads, our bridges, our schools, making sure that, you know, our veterans are getting the care that they need when it comes to post-traumatic stress disorder and traumatic brain injury, making sure that the certifications that they need for good jobs of the future are in place.",President,DEMOCRAT,2012-10-22.txt,27651,71,791,-0.303275,1,0,0,1,0,0,0,0,0,1
0,Obama,"You know, I was having lunch with some -- a veteran in Minnesota who had been a medic dealing with the most extreme circumstances.",President,DEMOCRAT,2012-10-22.txt,27652,24,792,-0.323509,0,0,0,0,0,0,0,0,0,0
0,Obama,"When he came home and he wanted to become a nurse, he had to start from scratch.",President,DEMOCRAT,2012-10-22.txt,27653,17,793,-0.232601,0,0,0,0,0,0,0,0,0,0
-1,Obama,And what we've said is let's change those certifications.,President,DEMOCRAT,2012-10-22.txt,27654,9,794,0.475041,0,0,0,0,0,0,0,0,0,0
1,Obama,The first lady has done great work with an organization called Joining Forces putting our veterans back to work.,President,DEMOCRAT,2012-10-22.txt,27655,19,795,0,0,0,0,0,0,0,0,0,0,0
1,Obama,"And as a consequence, veterans' unemployment is actually now lower than general population.",President,DEMOCRAT,2012-10-22.txt,27656,13,796,-0.637452,1,0,0,0,0,0,1,0,1,2
1,Obama,It was higher when I came into office.,President,DEMOCRAT,2012-10-22.txt,27657,8,797,0,1,0,0,0,0,0,1,0,1,2
-1,Obama,So those are the kinds of things that we can now do because we're making that transition in Afghanistan.,President,DEMOCRAT,2012-10-22.txt,27658,19,798,0,0,0,0,0,0,0,0,0,0,0
1,Romney,"No, it's not time to divorce a nation on Earth that has 100 nuclear weapons and is on the way to double that at some point, a nation that has serious threats from terrorist groups within its nation, as I indicated before, the Taliban, Haqqani Network.",Governor,REPUBLICAN,2012-10-22.txt,27665,46,805,-0.79206,0,0,0,0,0,0,0,0,0,0
1,Romney,It's a nation that's not like -- like others and it does not have a civilian leadership that is calling the shots there.,Governor,REPUBLICAN,2012-10-22.txt,27666,23,806,0,0,0,0,0,0,0,0,0,0,0
0,Romney,"You have the ISI, their intelligence organization, is probably the most powerful of the -- of three branches there.",Governor,REPUBLICAN,2012-10-22.txt,27667,19,807,0.453038,0,0,0,0,0,0,0,0,0,0
-1,Romney,Then you have the military and then you have the civilian government.,Governor,REPUBLICAN,2012-10-22.txt,27668,12,808,0,0,0,0,0,0,0,0,0,0,0
1,Romney,"This is a nation, which, if it falls apart, if it -- if it becomes a failed state, there are nuclear weapons there and you've got -- you've got terrorists there who could grab their -- their hands onto those nuclear weapons.",Governor,REPUBLICAN,2012-10-22.txt,27669,42,809,-0.717176,0,0,0,0,0,0,0,0,0,0
-1,Romney,This is -- this is an important part of the world for us.,Governor,REPUBLICAN,2012-10-22.txt,27670,13,810,0.82605,0,0,0,0,0,0,0,0,0,0
-1,Romney,"Pakistan is -- is technically an ally, and they're not acting very much like an ally right now.",Governor,REPUBLICAN,2012-10-22.txt,27671,18,811,0,0,0,0,0,0,0,0,0,0,0
-1,Romney,But we have some work to do.,Governor,REPUBLICAN,2012-10-22.txt,27672,7,812,-0.348722,0,0,0,0,0,0,0,0,0,0
1,Romney,And I -- I don't blame the administration for the fact that the relationship with Pakistan is strained.,Governor,REPUBLICAN,2012-10-22.txt,27673,18,813,-0.811336,0,0,0,0,0,0,0,0,0,0
-1,Romney,We -- we had to go into Pakistan.,Governor,REPUBLICAN,2012-10-22.txt,27674,8,814,-0.400175,0,0,0,0,0,0,0,0,0,0
-1,Romney,We had to go in there to get Osama bin Laden.,Governor,REPUBLICAN,2012-10-22.txt,27675,11,815,-0.369561,0,0,0,0,0,0,0,0,0,0
-1,Romney,That was the right thing to do.,Governor,REPUBLICAN,2012-10-22.txt,27676,7,816,0.234703,0,0,0,0,0,0,0,0,0,0
-1,Romney,"And -- and that upset them, but obviously there was a great deal of anger even before that.",Governor,REPUBLICAN,2012-10-22.txt,27677,18,817,0,0,0,0,0,0,0,0,0,0,0
-1,Romney,But we're going to have to work with the -- with the people in Pakistan to try and help them move to a more responsible course than the one that they're on.,Governor,REPUBLICAN,2012-10-22.txt,27678,32,818,0.223529,0,0,0,0,0,0,0,0,0,0
-1,Romney,And it's important for them.,Governor,REPUBLICAN,2012-10-22.txt,27679,5,819,0.491596,0,0,0,0,0,0,0,0,0,0
-1,Romney,It's important for the nuclear weapons.,Governor,REPUBLICAN,2012-10-22.txt,27680,6,820,0,0,0,0,0,0,0,0,0,0,0
-1,Romney,It's important for the success of Afghanistan.,Governor,REPUBLICAN,2012-10-22.txt,27681,7,821,0.432999,0,0,0,0,0,0,0,0,0,0
0,Romney,"Because inside Pakistan, you have a -- a large group of Pashtun that are -- that are Taliban.",Governor,REPUBLICAN,2012-10-22.txt,27682,18,822,-0.521067,0,0,0,0,0,0,0,0,0,0
-1,Romney,And that's one of the reasons the Afghan Security Forces have so much work to do to be able to fight against that.,Governor,REPUBLICAN,2012-10-22.txt,27684,23,824,-0.653054,0,0,0,0,0,0,0,0,0,0
-1,Romney,But it's important for us to recognize that we can't just walk away from Pakistan.,Governor,REPUBLICAN,2012-10-22.txt,27685,15,825,0,0,0,0,0,0,0,0,0,0,0
-1,Romney,"But we do need to make sure that as we -- as we send support for them, that this is tied to them making progress on -- on matters that would lead them to becoming a civil society.",Governor,REPUBLICAN,2012-10-22.txt,27686,38,826,0.560155,0,0,0,0,0,0,0,0,0,0
0,Romney,"And it's widely reported that drones are being used in drone strikes, and I support that and entirely, and feel the president was right to up the usage of that technology, and believe that we should continue to use it, to continue to go after the people that represent a threat to this nation and to our friends.",Governor,REPUBLICAN,2012-10-22.txt,27689,58,829,0.865752,0,0,0,0,0,0,0,0,0,0
-1,Romney,"But let me also note that as I said earlier, we're going to have to do more than just going after leaders and -- and killing bad guys, important as that is.",Governor,REPUBLICAN,2012-10-22.txt,27690,32,830,-0.336807,0,0,0,0,0,0,0,0,0,0
1,Romney,We're also going to have to have a farm more effective and comprehensive strategy to help move the world away from terror and Islamic extremism.,Governor,REPUBLICAN,2012-10-22.txt,27691,25,831,0.511202,0,0,0,0,0,0,0,0,0,0
-1,Romney,We haven't done that yet.,Governor,REPUBLICAN,2012-10-22.txt,27692,5,832,-0.284384,0,0,0,0,0,0,0,0,0,0
-1,Romney,"We talk a lot about these things, but you look at the -- the record, you look at the record.",Governor,REPUBLICAN,2012-10-22.txt,27693,20,833,0.55348,0,0,0,0,0,0,0,0,0,0
-1,Romney,You look at the record of the last four years and say is Iran closer to a bomb?,Governor,REPUBLICAN,2012-10-22.txt,27694,18,834,-0.661143,0,0,0,0,0,0,0,0,0,0
-1,Romney,Is the Middle East in tumult?,Governor,REPUBLICAN,2012-10-22.txt,27696,6,836,-0.519696,0,0,0,0,0,0,0,0,0,0
-1,Romney,"Is -- is al-Qaida on the run, on its heels?",Governor,REPUBLICAN,2012-10-22.txt,27698,10,838,-0.686726,0,0,0,0,0,0,0,0,0,0
-1,Romney,Is -- are Israel and the Palestinians closer to reaching a peace agreement?,Governor,REPUBLICAN,2012-10-22.txt,27700,13,840,-0.293849,0,0,0,0,0,0,0,0,0,0
0,Romney,"No, they haven't had talks in two years.",Governor,REPUBLICAN,2012-10-22.txt,27701,8,841,-0.470354,0,0,0,0,0,0,0,0,0,0
-1,Romney,"We have not seen the progress we need to have, and I'm convinced that with strong leadership and an effort to build a strategy based upon helping these nations reject extremism, we can see the kind of peace and prosperity the world demands.",Governor,REPUBLICAN,2012-10-22.txt,27702,43,842,0.95014,0,0,0,0,0,0,0,0,0,0
-1,Obama,"Well, keep in mind our strategy wasn't just going after bin Laden.",President,DEMOCRAT,2012-10-22.txt,27703,12,843,0,0,0,0,0,0,0,0,0,0,0
1,Obama,"We created partnerships throughout the region to deal with extremism in Somalia, in Yemen, in Pakistan.",President,DEMOCRAT,2012-10-22.txt,27704,16,844,-0.346519,0,0,0,0,0,0,0,0,0,0
1,Obama,"And what we've also done is engaged these governments in the kind of reforms that are actually going to make a difference in people's lives day to day, to make sure that their governments aren't corrupt, to make sure that they're treating women with the kind of respect and dignity that every nation that succeeds has shown and to make sure that they've got a free market system that works.",President,DEMOCRAT,2012-10-22.txt,27705,70,845,0.971639,0,0,0,0,0,0,0,0,0,0
-1,Obama,"So across the board, we are engaging them in building capacity in these countries.",President,DEMOCRAT,2012-10-22.txt,27706,14,846,0.425022,0,0,0,0,0,0,0,0,0,0
-1,Obama,And we have stood on the side of democracy.,President,DEMOCRAT,2012-10-22.txt,27707,9,847,0,1,0,0,0,1,0,0,0,0,1
1,Obama,"One thing I think Americans should be proud of, when Tunisians began to protest, this nation -- me, my administration -- stood with them earlier than just about any country.",President,DEMOCRAT,2012-10-22.txt,27708,30,848,0,0,0,0,0,0,0,0,0,0,0
1,Obama,In Egypt we stood on the side of democracy.,President,DEMOCRAT,2012-10-22.txt,27709,9,849,0,0,0,0,0,0,0,0,0,0,0
0,Obama,In Libya we stood on the side of the people.,President,DEMOCRAT,2012-10-22.txt,27710,10,850,-0.317246,0,0,0,0,0,0,0,0,0,0
-1,Obama,"And as a consequence, there's no doubt that attitudes about Americans have changed.",President,DEMOCRAT,2012-10-22.txt,27711,13,851,-0.211171,0,0,0,0,0,0,0,0,0,0
-1,Obama,But there are always going to be elements in these countries that potentially threaten the United States.,President,DEMOCRAT,2012-10-22.txt,27712,17,852,0,0,0,0,0,0,0,0,0,0,0
-1,Obama,And we want to shrink those groups and those networks and we can do that.,President,DEMOCRAT,2012-10-22.txt,27713,15,853,0,0,0,0,0,0,0,0,0,0,0
-1,Obama,But we're always also going to have to maintain vigilance when it comes to terrorist activities.,President,DEMOCRAT,2012-10-22.txt,27714,16,854,-0.37719,0,0,0,0,0,0,0,0,0,0
1,Obama,"The truth, though, is that Al Qaeda is much weaker than it was when I came into office.",President,DEMOCRAT,2012-10-22.txt,27715,18,855,-0.41805,0,0,0,0,0,0,0,0,0,0
1,Obama,And they don't have the same capacities to attack the U.S. homeland and our allies as they did four years ago.,President,DEMOCRAT,2012-10-22.txt,27716,21,856,-0.257634,0,0,0,0,0,0,0,0,0,0
-1,Obama,"Well, I think it will continue to be terrorist networks.",President,DEMOCRAT,2012-10-22.txt,27721,10,861,0,0,0,0,0,0,0,0,0,0,0
-1,Obama,"But with respect to China, China is both an adversary, but also a potential partner in the international community if it's following the rules.",President,DEMOCRAT,2012-10-22.txt,27723,24,863,0.671672,0,0,0,0,0,0,0,0,0,0
-1,Obama,So my attitude coming into office was that we are going to insist that China plays by the same rules as everybody else.,President,DEMOCRAT,2012-10-22.txt,27724,23,864,0,0,0,0,0,0,0,0,0,0,0
1,Obama,I know Americans had seen jobs being shipped overseas; businesses and workers not getting a level playing field when it came to trade.,President,DEMOCRAT,2012-10-22.txt,27725,23,865,-0.233934,0,0,0,0,0,0,0,0,0,0
0,Obama,And that's the reason why I set up a trade task force to go after cheaters when it came to international trade.,President,DEMOCRAT,2012-10-22.txt,27726,22,866,-0.618531,0,0,0,0,0,0,0,0,0,0
1,Obama,That's the reason why we have brought more cases against China for violating trade rules than the other -- the previous administration had done in two terms.,President,DEMOCRAT,2012-10-22.txt,27727,27,867,-0.492461,1,0,0,0,1,0,0,0,0,1
-1,Obama,"And we've won just about every case that we've filed, that has been decided.",President,DEMOCRAT,2012-10-22.txt,27728,14,868,0.626392,0,0,0,0,0,0,0,0,0,0
1,Obama,"In fact, just recently steelworkers in Ohio and throughout the Midwest -- Pennsylvania -- are in a position now to sell steel to China because we won that case.",President,DEMOCRAT,2012-10-22.txt,27729,29,869,0.511088,0,0,0,0,0,0,0,0,0,0
1,Obama,We had a tire case in which they were flooding us with cheap domestic tires -- or -- or cheap Chinese tires.,President,DEMOCRAT,2012-10-22.txt,27730,22,870,-0.862387,1,0,0,0,1,0,0,0,0,1
1,Obama,And we put a stop to it and as a consequence saved jobs throughout America.,President,DEMOCRAT,2012-10-22.txt,27731,15,871,0.248733,1,0,0,0,1,0,0,0,0,1
0,Obama,I have to say that Governor Romney criticized me for being too tough in that tire case; said this wouldn't be good for American workers and that it would be protectionist.,President,DEMOCRAT,2012-10-22.txt,27732,31,872,-0.727949,0,0,0,0,0,0,0,0,0,0
-1,Obama,"But I tell you, those workers don't feel that way.",President,DEMOCRAT,2012-10-22.txt,27733,10,873,-0.503644,0,0,0,0,0,0,0,0,0,0
-1,Obama,They feel as if they had finally an administration who was going to take this issue seriously.,President,DEMOCRAT,2012-10-22.txt,27734,17,874,0,0,0,0,0,0,0,0,0,0,0
-1,Obama,"Over the long term, in order for us to compete with China, we've also got to make sure, though, that we're taking -- taking care of business here at home.",President,DEMOCRAT,2012-10-22.txt,27735,30,875,0.673185,0,0,0,0,0,0,0,0,0,0
1,Obama,"If we don't have the best education system in the world, if we don't continue to put money into research and technology that will allow us to create great businesses here in the United States, that's how we lose the competition.",President,DEMOCRAT,2012-10-22.txt,27736,41,876,0,0,0,0,0,0,0,0,0,0,0
-1,Obama,"And, unfortunately, Governor Romney's budget and his proposals would not allow us to make those investments.",President,DEMOCRAT,2012-10-22.txt,27737,16,877,-0.75163,0,0,0,0,0,0,0,0,0,0
-1,Romney,"Well, first of all, it's not government that makes business successful.",Governor,REPUBLICAN,2012-10-22.txt,27740,11,880,0.266814,0,0,0,0,0,0,0,0,0,0
1,Romney,It's not government investments that makes businesses grow and hire people.,Governor,REPUBLICAN,2012-10-22.txt,27741,11,881,0,0,0,0,0,0,0,0,0,0,0
-1,Romney,"Let me also note that the greatest threat that the world faces, the greatest national security threat is a nuclear Iran.",Governor,REPUBLICAN,2012-10-22.txt,27742,21,882,-0.274274,0,0,0,0,0,0,0,0,0,0
0,Romney,"China has an interest that's very much like ours in one respect, and that is they want a stable world.",Governor,REPUBLICAN,2012-10-22.txt,27744,20,884,0.872054,0,0,0,0,0,0,0,0,0,0
-1,Romney,They don't want to see protectionism.,Governor,REPUBLICAN,2012-10-22.txt,27746,6,886,-0.444077,0,0,0,0,0,0,0,0,0,0
1,Romney,"They don't want to see the world break out into -- into various forms of chaos, because they have to -- they have to manufacture goods and put people to work and they have about 20,000 -- 20 million, rather, people coming out of the farms every year coming into the cities, needing jobs.",Governor,REPUBLICAN,2012-10-22.txt,27747,54,887,-0.649801,0,0,0,0,0,0,0,0,0,0
-1,Romney,So they want the economy to work and the world to be free and open.,Governor,REPUBLICAN,2012-10-22.txt,27748,15,888,0,0,0,0,0,0,0,0,0,0,0
-1,Romney,And so we can be a partner with China.,Governor,REPUBLICAN,2012-10-22.txt,27749,9,889,0.603603,0,0,0,0,0,0,0,0,0,0
-1,Romney,"We don't have to be an adversary in any way, shape or form.",Governor,REPUBLICAN,2012-10-22.txt,27750,13,890,0,0,0,0,0,0,0,0,0,0,0
-1,Romney,"We can work with them, we can collaborate with them, if they're willing to be responsible.",Governor,REPUBLICAN,2012-10-22.txt,27751,16,891,0.711823,0,0,0,0,0,0,0,0,0,0
-1,Romney,"Now, they look at us and say, Is it a good idea to be with America?",Governor,REPUBLICAN,2012-10-22.txt,27752,16,892,0.699759,0,0,0,0,0,0,0,0,0,0
-1,Romney,How strong are we going to be?,Governor,REPUBLICAN,2012-10-22.txt,27753,7,893,0.388991,0,0,0,0,0,0,0,0,0,0
-1,Romney,How strong is our economy?,Governor,REPUBLICAN,2012-10-22.txt,27754,5,894,0,0,0,0,0,0,0,0,0,0,0
1,Romney,"They look at the fact that we owe 'em a trillion dollars and owe other people $16 trillion in total, including that.",Governor,REPUBLICAN,2012-10-22.txt,27755,22,895,-0.287252,1,0,0,0,0,0,0,0,1,1
-1,Romney,They look at our -- our decision to -- to cut back on our military capabilities.,Governor,REPUBLICAN,2012-10-22.txt,27756,16,896,0.596185,0,0,0,0,0,0,0,0,0,0
1,Romney,The secretary of defense called these trillion dollars of cuts to our military devastating.,Governor,REPUBLICAN,2012-10-22.txt,27758,14,898,-0.773714,0,0,0,0,0,0,0,0,0,0
1,Romney,"It's not my term, it's the president's own secretary of defense called these trillion dollars of cuts to our military devastating.",Governor,REPUBLICAN,2012-10-22.txt,27759,21,899,-0.81959,0,0,0,0,0,0,0,0,0,0
-1,Romney,"They look at America's commitments around the world and they see what's happening, and they say, well, OK. Is America going to be strong?",Governor,REPUBLICAN,2012-10-22.txt,27761,24,901,0.73802,0,0,0,0,0,0,0,0,0,0
-1,Romney,"And the answer is, yes, if I'm president, America will be very strong.",Governor,REPUBLICAN,2012-10-22.txt,27762,13,902,0.772734,0,0,0,0,0,0,0,0,0,0
-1,Romney,We'll also make sure that we have trade relations with China that work for us.,Governor,REPUBLICAN,2012-10-22.txt,27763,15,903,0.410243,0,0,0,0,0,0,0,0,0,0
1,Romney,"I've watched year in and year out as companies have shut down and people have lost their jobs because China has not played by the same rules, in part by holding down artificially the value of their currency.",Governor,REPUBLICAN,2012-10-22.txt,27764,38,904,-0.666816,0,0,0,0,0,0,0,0,0,0
1,Romney,It holds down the prices of their goods.,Governor,REPUBLICAN,2012-10-22.txt,27765,8,905,0.408304,0,0,0,0,0,0,0,0,0,0
-1,Romney,It means our goods aren't as competitive and we lose jobs.,Governor,REPUBLICAN,2012-10-22.txt,27766,11,906,-0.639497,0,0,0,0,0,0,0,0,0,0
-1,Romney,They're making some progress; they need to make more.,Governor,REPUBLICAN,2012-10-22.txt,27768,9,908,0.343418,0,0,0,0,0,0,0,0,0,0
-1,Romney,"That's why on day one, i will label them a currency manipulator, which allows us to apply tariffs where they're taking jobs.",Governor,REPUBLICAN,2012-10-22.txt,27769,22,909,-0.394513,0,0,0,0,0,0,0,0,0,0
1,Romney,"They're stealing our intellectual property, our patents, our designs, our technology, hacking into our computers, counterfeiting our goods.",Governor,REPUBLICAN,2012-10-22.txt,27770,18,910,-0.590669,0,0,0,0,0,0,0,0,0,0
-1,Romney,They have to understand we want to trade with them.,Governor,REPUBLICAN,2012-10-22.txt,27771,10,911,-0.265931,0,0,0,0,0,0,0,0,0,0
-1,Romney,We want a world that's stable.,Governor,REPUBLICAN,2012-10-22.txt,27772,6,912,0.723882,0,0,0,0,0,0,0,0,0,0
-1,Romney,"We like free enterprise, but you got to play by the rules.",Governor,REPUBLICAN,2012-10-22.txt,27773,12,913,0.344688,0,0,0,0,0,0,0,0,0,0
-1,Romney,"Well, they sell us about this much stuff every year, and we sell them about this much stuff every year.",Governor,REPUBLICAN,2012-10-22.txt,27777,20,917,0.847707,0,0,0,0,0,0,0,0,0,0
-1,Romney,So it's pretty clear who doesn't want a trade war.,Governor,REPUBLICAN,2012-10-22.txt,27778,10,918,0.23321,0,0,0,0,0,0,0,0,0,0
1,Romney,"And there's one going on right now, which we don't know about it.",Governor,REPUBLICAN,2012-10-22.txt,27779,13,919,0.273805,0,0,0,0,0,0,0,0,0,0
1,Romney,"We have enormous trade imbalance with China, and it's worse this year than last year, and it's worse last year than the year before.",Governor,REPUBLICAN,2012-10-22.txt,27782,24,922,-0.885495,0,0,0,1,1,0,0,0,0,2
-1,Romney,And so we have to understand that we can't just surrender and lose jobs year in and year out.,Governor,REPUBLICAN,2012-10-22.txt,27783,19,923,-0.646544,0,0,0,0,0,0,0,0,0,0
